{
  "$schema": "../schema/skill-1.schema.json",
  "formatVersion": 1,
  "id": "app.preku.kind-words",
  "name": "Kind words",
  "version": "1.0.0",
  "author": { "name": "Piyush Gupta" },
  "description": "Thirty gentle lines for \"A moment for you\": no hustle, just a little warmth.",
  "license": "CC0-1.0",
  "contributes": {
    "thoughts": [
      { "text": "You don't have to finish everything today to have done enough." },
      { "text": "Small steps still move you forward." },
      { "text": "Be as patient with yourself as you are with a friend." },
      { "text": "Rest is not a reward. It's part of the plan." },
      { "text": "One thing at a time is still a lot of things." },
      { "text": "It's okay to start again in the middle of the day." },
      { "text": "Notice one thing that went right this morning." },
      { "text": "Your pace is allowed to be your own." },
      { "text": "Drink some water. Unclench your jaw. Carry on." },
      { "text": "Progress is often quiet." },
      { "text": "Being kind to yourself makes the work better, not softer." },
      { "text": "A messy first try is still a first try." },
      { "text": "You've handled hard days before." },
      { "text": "Leave a little room in the day for nothing at all." },
      { "text": "Good enough, done, is better than perfect, waiting." },
      { "text": "Look out of a window for a moment." },
      { "text": "Ask for help early. It saves everyone time." },
      { "text": "Curiosity is a good place to work from." },
      { "text": "Today counts, even if it's an ordinary one." },
      { "text": "You can change your mind when you learn something new." },
      { "text": "Close one tab you don't need." },
      { "text": "Celebrate the boring wins too." },
      { "text": "Breathe out a little longer than you breathe in." },
      { "text": "The plan can bend without breaking." },
      { "text": "Somebody is glad you're around." },
      { "text": "Feeling tired is information, not a verdict." },
      { "text": "Write down one thing so your head can let go of it." },
      { "text": "Slow is smooth, and smooth is fast." },
      { "text": "The best time to take a break is a little before you need one." },
      { "text": "Well begun is half done.", "author": "Aristotle" }
    ]
  }
}
